Evaluación,Respondiente,Respuesta_Pregunta_1,Respuesta_Pregunta_2,Respuesta_Pregunta_3,Respuesta_Pregunta_4,Respuesta_Pregunta_5
Parcial 1,Maria,"Basicamente los datos pueden atentar contra la democracia ya que son una herramienta que permite definir el perfil de una persona basado en los clicks que realiza mientras navega en las redes sociales. Una vez que se obtienen caracterisitcas y atributos sobre la persona, es muy facil dirigir propaganda politica estrategicamente dirigida a ciertas personas.","Cesar plantea el concepto de la auomatizaion que nos aumenta con el fin de reemplazar a los politicos. Es decir,la utilizacion de la inteligencia artiicial mezclada con la democracia directa. En sintesis es un asistente de software que respresenta a cada uno de nostros en la toma de desiciones. En terminos simples, creamos un avatar, lo entrenamos y hacemos que entienda nuestras preferencias politicas para que luego todos los avatares participen en la toma de desiciones bajo la democracia directa.","Los datos no son el nuevo petroleo ya que, estos por si solos no sirven de absolutmente nada. Es necesario que los datos pasen por un proceso de analitica de datos con el fin de que puedan ser interpretados y se pueda predecir el futuro con base en estos.","Para pasar de datos a informacion, es necesario seguir los pasos propios de los procedimientos tipicos de la analitica de datos. en este sentido, es fundamental que se tomen los datos y se limpen, luego se tranformen, se mejoren y se resuman.","La paradoja de simpson nos deja la enseñanza de que debemos tener mucho cuidado al analizar los datos, ya que estos pueden generar una perspectiva cuando se analizan de forma bivariada y se pueden sacar conclusiones erradas. Lo anterior por que en ciertos casos, cuando se agrega una tercera variable al analisi, estos generan una perspectiva diferente de cuando se hacia de forma bivariado.

Por otro lado, el cuarteto de anscombe nos enseña que al momento de realizar un analisis de correlacion podemos establecer que las variables tienen una relacion lineal. Pero al visualizar las variables y sus correlaciones podemos observar que no necesariamiente las correclaciones son lineal."
Parcial 1,Miguel,"Según el video, los datos de las personas pueden ser usados para atentar a la democracia porque pueden apelar a los gustos personales de las personas, a las personas con quien ellos se relacionan, a las actividades que ellos realizan y modificar el discurso o las promesa para que el candidato a elegir tenga una mayor ""adhesión"" con lo que las personas están buscando. Estos discursos pueden ser con base en las creencias, en la religión, en los valores y demás preferencias y al ser tan personales pueden volverse muy atractivos y confundir a las personas haciendolas escuchar lo que quieren escuchar.","En pocas palabras, lo que Hidalgo propone es automatizar a los políticos. La manera de hacerlo es a través del uso de avatares virtuales con las preferencias personales de cada ciudadano para que ellos sean los que constantemente tomen las decisiones con base en las preferencias del ciudadano al que representan. Estos tendrían que llenar encuestas para la recopilación de sus datos personales, luego elegir el algoritmo que más se ajuste a ellos y finalmente corregirlo dadas las decisiones que tome. Es una democracia directa manejada por avatares virtuales.","Lo que explica el artículo del World Economic Forum es que si bien los datos y el pretróleo son capaces de generar valor, su diferencia fundamental es en la limitante de volumen de los mismos. Tomando como ejemplo al petróleo, en el mundo existe una reserva finita de este recurso, lo que hace que a mayor cantidad de guarde y haya menos transabilidad, mejor retiene su valor. En los datos ocurre algo diferente, entre más datos se recojan y de mejor manera de combinen y analicen, o transen, mayor valor generan en el largo plazo.","Dado que en el mundo real, muy pocas veces se cuenta con datos ordenados y estandarizados, los datos se deben preparar previamente al análisis para ser utilizados correctamente sin ningún sesgo. Por lo tanto, antes de pasar de datos a información, se debe realizar un Pre-Procesamiento de los mismos, que resulta en técnicas como la Limpieza, la Transformación, el Mejoramiento de los mismo y Resumirlos dado que se requiera","Estas dos paradojas se utilizan para ilustrar que muchas veces la explicación de una serie de datos ordenados puede estar incompleta si no se analiza desde distintos ángulos. Empezando con la paradoja de Simpson, esta específicamente habla de que la tendencia que aparece en varias series de datos separadas, al unirlas desaparece cuando estos se combinan. La paradoja de Anscombe menciona que aún cuando distintos conjuntos de datos puedan tener las mismas identidades estadísticas (media, mediana, moda, Desv. Estándar) al gráficar sus datos pueden presentar historias totalmente distintas."
Parcial 1,Nicolas,"Hoy en dia, se ha visto una tendencia en redes sociales acerca de campañas publicitarias y demás datos obtenidos para hacer politica, esto por medio de clicks. Se puede ver en el pasado en la democracia, las personas estaban ""dispuestas"" a votar por aquellos politicos que consideraban eran la mejor eleccion para la toma de decisiones en el gobierno. Sin embargo, como se ha visto estas personas no han brindado mucha credibilidad sobre las ejecuciones que hacen de sus proyectos. Por lo que, la democracia se ha visto en peligro ya que las personas no quieren seguir votando por ""representantes"" con los cuales no se sienten identificados, por otro lado, como se ve en el video, los proyectos de ley tienen una alta demanda por lo que un solo politico no puede hacerse cargo de esto lo cual genera poca confianza en las personas que votaron por él. Por ultimo, como se vio en el video, se han visto tendencias de mejorar la democracia por dos metodos; Democracia Directa y Democracia Liquida, nuevas formas de sacar a los politicos del poder y que los cuidadanos puedan tomar las decisiones correspondientes.","La idea principal consiste en automatizar a los politicos. Esto mediante el proceso de encontrar la necesidad que se quiere suplir, encontrar las herramientas que usaremos y en consecuencia como las personas estan usandolas para automatizarlas tambien a ellas. Esto se basa en que al futuro, se administre la fuerza de trabajo con una autonomia donde las personas no intervengan directamente en los procesos, esto por medio de la tecnologia de ampliacion; mas sistemas en el ancho de banda cognitiva para que las personas tomen decisiones. Por otro lado, tambien para realizar todo el proceso, se deben tener unos canales directos tales como avatares y asistentes que ayuden con recomendaciones para mejores el volumen de informacion. Tambien Cesar nos comenta el uso de la Inteligencia Artificial, al momento de automatizar los procesos y brindarle el ""poder"" a la tecnologia, todo será mucho más rapido y agil. Como se puede ver en la Democracia Directa, si los procesos son autonomos, cada persona podrá ser identificada y representada por un agente de software personalizado lo que generara un alcance mayor en cuanto a la toma de decisiones y tambien a la toma de la data, debido a que por medio de algoritmos se podrá identificar los comportamientos humanos para tener mejores predicciones.","Como se ha visto hoy en día, se le ha brindado mucha importancia al manejo y recoleccion de datos, sin embargo como podemos ver en el articulo mencionado en clase (Tratar los datos como el petroleo ha llevado a alguno gobiernos a acumularlos en silos, bien protegidos dentro de sus fronteras), esto se ha visto reflejado en la reduccion de los beneficos economicos y sociales de los datos. El petroleo es un recurso no renovable que a futuro tendra altos niveles de escasez donde problablemente tendremos que encontrar más fuentes de energía para poder transportarnos o encontrar productos sustitutos del petroleo, por el contrario como se ha visto los datos son informacion en primer lugar de suma importancia para tomar acciones y analizar tendencias ya sean de comportamiento o de indicadores que nos indiquen como funciona el mundo hoy en día, en segundo lugar, son recursos que siempre asi sea hoy o en 40 años, tendremos a la mano. Todo el tiempo estamos sacando datos, ya sea para ir a comprar un dulce o para realizar un examen, es por esto que el analisis de datos no es el nuevo petroleo, el 10 años tendremos más datos pero menos este recurso no renovable. Tambien como lo menciona la lectura, para tener valor en el area del petroleo, debemos tener muchos barriles de esto, sin embargo en los datos podemos tener solo 1, pero puede ser de suma importancia para su analisis.","En primer lugar, hacer un analisis de los datos, ponerlos en contexto con el rumbo del negocio. Brindarles la importancia necesaria identificando por que sirven para nuestra compañia, de acuerdo con este analisis se toma la decision de convertirla en informacion relevante, esto con el fin de basarnos en estos para tomar decisiones importantes de acuerdo con un sector, una tendencia o demás que los datos hayan arrojado. Los datos es un registro cuantitativo que se toma dependiendo de una observacion y la informacion es el conjunto de los datos, por lo que es necesario identificar el proceso para pasar datos que pueden percibirse como insignificantes a información de suma importancia para la toma de decisiones.

","La recoleccion de los datos es una actividad de suma importancia por lo que se tiene que tener cuidado a la hora de elegirlos y analizarlos. Como se puede ver en el cuarteto de Anscombre, los datos pueden percibirse como ""iguales"" sin embargo a mayor profundidad de analisis, demuestra todo lo contrario. Con respecto a los dos metodos de analisis de datos mencionados en la pregunta, nos da una leccion muy importante. Brindarle la importancia necesaria a los datos que obtenemos, esto mediante el analisis para no perder de vista ningun detalle y no cometer errores que pueden ser perjudiciales para nuestras compañias. La obtencion de datos debe ser detallada y cautelosa, siempre intentando tener una vision objetiva , para no sesgarnos cuando estemos en este proceso, cualquier detalle puede perjudicarnos o favorecernos. ¡Prestar mucha atencion a los datos!"
Parcial 1,Pedro,"En el video, Cesar expone la idea de juntar o integrar la democracia con agentes de inteligencia artificial. De esta manera es posible establecer o analizar los gustos de una persona o la manera de actuar a traves de las paginas web que visitan, lo que buscan y donde hacen click. De esta manera como lo dice la pregunta es posible poner propaganda politica a las personas especificas de manera quirurgica y llevan de manera casi disruptiva la propaganda al cliente a traves de la maquinaria de inteligencia artificial.",Cesar plantea la idea de utilizar inteligencia artificial dentro de estos procesos politicos. Esto se logra al crear codigos o algoritmos personificados. Esto significa que estos codigos van a conocer los gustos de las personas y vana tomar las decisiones con base en este conociemiento de las personas en la democracia,"Como se mencionaba, los datos como tal no tienen un valor especifico. El valor de los datos se obtiene en el momento en el que se entiende el valor del conocimiento que estos transmiten. Por esta razon es necesario que los datos pasen por un analisis y sean extraidas las diferentes opciones de resultados que s epuedan extraer",Esto a traves de los diferentes lenguages de lectura y extraccion de datos. Es importante poder leer los datos y bajo estos metodos de inteligencia artificial poder extraer la datos que nos lleven a informacion en vez de simples datos.,"Al ingresar una tercera variable es posible analizar los datos de manera errada ya que es necesario hacer un analisis mas profundo y a la hora de no analizar bien se pueden analizar resultados erroneos. Por otro lado, el cuarteto de Anscombe nos ense;a que es necesario y pertinente analizar los datos de manera grafica antes de llegar a conclusiones"
Parcial 1,Samuel,"Según Cesar Hidalgo, el uso de estos datos podría atentar contra la democracia al focalizar los datos en realizar propaganda política y así lograr obtener la representación del pueblo en la política al focalizar ciertos mensajes por medio de propaganda que lleve a movilizar a la población a votar por un político específicamente.","La idea de Cesar Hidalgo consiste en apoyar la política actual con herramientas tecnológicas como la inteligencia artifical. Lo que él plantea es que por medio de la web se cree un avatar que represente a cada una de las personas y así, en vez de centralizar el poder en una sola persona, cada uno tenga la autonomía de poder ejercer la política por medio de un algoritmo que aprende según la afinidad política de la persona. El algoritmo se alimentaría de los datos que la persona brinda por medio de encuestas que realiza en la web y que pertenecen a diferentes tipos de temas. Él se refiere que no habría manipulación de datos, ya que cada uno sería un mercado independiente que busca alimentar el algoritmo personal que le da vida y poder al Avatar.","La comparación entre los datos y el petróleo no es correcta porque son todo lo contrario. Mientras que el petróleo es finito, los datos vienen creciendo de forma exponencial y son perdurables en el tiempo. Además, la forma de dar valor al petróleo depende de la demanda del mismo y como es un bien que tiende a la escazes, su valor aumenta, por otro lado, el valor de los datos no tiene relación con su tamaño o cantidad, si no con la extración de análisis e información relevante para las organizaciones. También, mientras el petróleo tiene un fin único después de ser procesado, los datos pueden ser reutilizados para nuevas investigaciones y llegar a nuevos descubrimientos que mejoren la calidad de vida humana.

Desde mi punto de vista, creería que se compara a los datos con el petróleo por el boom y el valor que este ha tenido durante la historia de la humanidad, pero no se puede decir que los datos son igual que el petróleo o que funcionan de la misma forma para crear valor a la humanidad. ","Para lograr pasar los datos a la información es necesario realizar una manipulación desde su origen para lograr organizarlos y obtener información de ellos. Este proceso se puede entender en tres simples pasos:

Datos: en esta primera etapa se obtienen datos po diferentes medios como lo pueden ser rastreo de clicks, cookies, recoleción de datos específicos por medio de encuestas, etc. Estos datos llegan como registros.

Manejo de datos e información: en esta segunda etapa, se moldean los datos, se organizan en bases de datos, o en un archivo en el cual se entienda la lógica detrás de los datos. En este punto se puede construir una sítesis de los datos que nos llevan a la información general de un set de data.

Conocimiento: este es el paso en donde la información se analiza y se obtienen insights sobre la información. Acá se usa estadística para entender la relación entre variables y qué impacto tiene en lon que se está analizando","La paradoja de Simpson nos deja como eseñanza que es importante marcar la tendencia de los datos antes de hacer una conclusión. Esto se debe a que los datos pueden tener una tendencia positiva en la gráfica, pero cuando se convinan los datos, la tendencia puede ser diferente. Esto nos lleva a que es importante marcar la tendencia y hacer un análisis más detallado de cada variable o segmento que se busca estudiar para no caer en una interpretación erronea.

Por otro lado, en el cuarteto de Anscombe el aprendizaje está en que graficar los datos a pesar de ser los mismos en las tablas que el archivo nos muestre, pues la relación entre ellas puede ser diferente y por ende se va a ver reflejado en la tendencia de estos."
Parcial 1,Santiago,"El uso de los datos que compartimos diariamente atenta contra la democracia porque la mayoría de los políticos hacen uso de estos para poder llegar al público y ""llamar su atención."" De esta forma, al momento de tomar decisiones políticas ellos realmente no están haciendo lo que la democracia pide, sino lo que los datos les demuestran que los convienen para ganar más votos, más seguidores y demás.","Lo que el propone es que se haga uso de la inteligencia artificial par tomar las decisiones legislativas, para esto se crearían avatares que ayuden a procesar y tomar las decisiones. Esta idea propone que cada persona cree su avatar a partir de unas preguntas que recolectarían la data y a partir de ahí se crea un algoritmo que prediga sus ""gustos"" o preferencias políticas y por lo tanto, ahí empiece a generar un perfil que el usuario pueda verificar. Lo que esto permite es que la democracia sea automatizada y simplificada, pues un legislador tiene muchas responsabilidades y proyectos y le es imposible tener en cuenta la opinión de todos y al final tomar decisiones ""democráticas"".","Los datos se comparan constantemente con el petróleo, sin embargo decir que ""los datos son el nuevo petróleo"" está equivocado porque varias razones. La primera, el valor del petróleo proviene de su escasez y lo difícil que es extraerlos, por el contrario los datos se generan constantemente y cada vez es más fácil generarlos. La segunda razón, es que el petróleo se entiende como un producto básico, cuando lo usas, este se consume y no se puede volver a usar, los datos en cambio se pueden reutirlizar y compartir para darles nuevos usos. Sin embargo, en el caso de los datos no basta con acumularlos, es necesario saber analizarlos para incrementar su valor.","Para poder pasar los datos a la información es necesario hacerles una manipulación, esto, ya que la mayoría de las veces los bases de datos presentan deficiencias tales como que están desordenadas, no tienen variables relevantes, las observaciones pueden estar incompletas, entre muchas otras deficiencias. Para esto, hay unos procedimientos típicos como la limpieza, la transformación y/o mejoramiento de datos.","La lección de la paradoja de Simpson es que hacer conclusiones generales de los datos la mayoría de las veces puede estar equivocado, estas conclusiones no se pueden asumir como ciertas si no se conoce la todalidad de los datos en los que está basado el análisis. Por ejemplo, si se mira a rasgos generales una linea de tendencia de un grupo de datos y se concluye que esta es ascendete, dicha conclusión puede estar equivocada, pues dentro de la base de datos, pueden haber grupos con diferentes tendencias (arriba o abajo).

La lección del cuarteto de Anscombe es que si se analizan solamente las variables estadísticas de un grupo de datos, puede darse el caso de que estas sean muy similares o incluso iguales y la conclusión sería que los datos tienen un comportamiento similar. Sin embargo, si se analizan estas variables estadísiticas en un gráfico, su comportamiento será totalmente diferente y por lo tanto la conclusión general que se hizo estaría errada. Siempre que se analizan datos no basta con calcular sus propiedades estadísticas, las gráficas son necesarias para llegar a conclusiones más precisas."
